{
  "$schema": "./schema.json",
  "name": "ai-tool-compliance-db",
  "description": "Open-source reference database mapping AI tools to BAA/DPA availability, default training behavior, and data retention posture, by product tier.",
  "maintainer": "Sui-Generis LLC (Andrew Rogers)",
  "license": "MIT",
  "version": "1.0.0",
  "generated": "2026-10-28",
  "disclaimer": "This database is a point-in-time reference compiled from public vendor documentation and third-party reporting. Vendor BAA, DPA, and training policies change frequently and without notice. This is NOT legal advice and NOT a substitute for confirming current terms directly with each vendor and, where PHI or privileged information is involved, with the client's own legal counsel before relying on any entry for a compliance decision. See the `confidence` and `last_verified` fields on each entry, and the README, before use.",
  "tool_count": 55,
  "tools": [
    {
      "id": "openai-chatgpt-free",
      "vendor": "OpenAI",
      "product": "ChatGPT",
      "tier": "Free",
      "tier_category": "Consumer Free",
      "category": "General-purpose chatbot",
      "trains_on_input_by_default": true,
      "training_opt_out_available": true,
      "baa_available": false,
      "baa_notes": "OpenAI does not offer a BAA for Free, Plus, or Team tiers.",
      "dpa_available": false,
      "data_retention_default": "Retained per account settings; subject to training unless opted out via Data Controls.",
      "confidence": "verified",
      "source_urls": [
        "https://help.openai.com/en/articles/8660679"
      ],
      "last_verified": "2026-10-28",
      "notes": "An opt-out exists in ChatGPT's Data Controls, but training is on by default. Never approved for PHI."
    },
    {
      "id": "openai-chatgpt-plus",
      "vendor": "OpenAI",
      "product": "ChatGPT",
      "tier": "Plus",
      "tier_category": "Consumer Paid",
      "category": "General-purpose chatbot",
      "trains_on_input_by_default": true,
      "training_opt_out_available": true,
      "baa_available": false,
      "baa_notes": "OpenAI does not offer a BAA for Free, Plus, or Team tiers.",
      "dpa_available": false,
      "data_retention_default": "Retained per account settings; subject to training unless opted out via Data Controls.",
      "confidence": "verified",
      "source_urls": [
        "https://help.openai.com/en/articles/8660679"
      ],
      "last_verified": "2026-10-28",
      "notes": "Same training/BAA posture as Free — paying for Plus does not itself unlock a BAA or training exclusion."
    },
    {
      "id": "openai-chatgpt-team",
      "vendor": "OpenAI",
      "product": "ChatGPT",
      "tier": "Team",
      "tier_category": "Business/Team",
      "category": "General-purpose chatbot",
      "trains_on_input_by_default": false,
      "training_opt_out_available": "n/a (not trained by default)",
      "baa_available": false,
      "baa_notes": "Business Data Terms exclude training by default; HIPAA Journal and third-party trackers report OpenAI will not sign a BAA at the Team tier even though training is off.",
      "dpa_available": true,
      "data_retention_default": "90 days default (configurable), per OpenAI's Business Data Terms.",
      "confidence": "verified",
      "source_urls": [
        "https://help.openai.com/en/articles/8660679"
      ],
      "last_verified": "2026-10-28",
      "notes": "Meaningfully better posture than Free/Plus (no training, DPA available), but still not HIPAA-eligible — do not treat as PHI-safe without an executed BAA."
    },
    {
      "id": "openai-chatgpt-enterprise---edu",
      "vendor": "OpenAI",
      "product": "ChatGPT",
      "tier": "Enterprise / Edu",
      "tier_category": "Enterprise",
      "category": "General-purpose chatbot",
      "trains_on_input_by_default": false,
      "training_opt_out_available": "n/a (not trained by default)",
      "baa_available": "conditional",
      "baa_notes": "OpenAI's own help center states sales-managed Enterprise/Edu accounts are BAA-eligible; some third-party trackers report OpenAI declining BAAs for ChatGPT even at Enterprise. Sources conflict — confirm directly with OpenAI sales before relying on this for a specific client.",
      "dpa_available": true,
      "data_retention_default": "Configurable; not used for training by default.",
      "confidence": "verified",
      "source_urls": [
        "https://help.openai.com/en/articles/8660679",
        "https://intuitionlabs.ai/articles/is-chatgpt-hipaa-compliant"
      ],
      "last_verified": "2026-10-28",
      "notes": "Treat as conditional/unresolved rather than a clean Yes until the specific client's sales-managed agreement is confirmed to include a signed BAA."
    },
    {
      "id": "openai-api-platform-pay-as-you-go---enterprise",
      "vendor": "OpenAI",
      "product": "API Platform",
      "tier": "Pay-as-you-go / Enterprise",
      "tier_category": "API/Developer",
      "category": "LLM API",
      "trains_on_input_by_default": false,
      "training_opt_out_available": "n/a (not trained by default since March 2023)",
      "baa_available": true,
      "baa_notes": "OpenAI offers a BAA for API customers on sales-managed/qualifying accounts.",
      "dpa_available": true,
      "data_retention_default": "Zero data retention available for qualifying use cases; standard retention otherwise 30 days (abuse monitoring).",
      "confidence": "verified",
      "source_urls": [
        "https://help.openai.com/en/articles/8660679"
      ],
      "last_verified": "2026-10-28",
      "notes": "The most HIPAA-friendly OpenAI surface — relevant when a client's own product calls the OpenAI API directly, not when staff use the ChatGPT consumer app."
    },
    {
      "id": "anthropic-claudeai-free",
      "vendor": "Anthropic",
      "product": "Claude.ai",
      "tier": "Free",
      "tier_category": "Consumer Free",
      "category": "General-purpose chatbot",
      "trains_on_input_by_default": true,
      "training_opt_out_available": true,
      "baa_available": false,
      "baa_notes": "Not covered — consumer plans (Free/Pro/Max) are explicitly excluded from Anthropic's BAA program.",
      "dpa_available": false,
      "data_retention_default": "5-year retention if training is not opted out; 30 days if opted out, per Anthropic's Sept. 2025 consumer policy change.",
      "confidence": "verified",
      "source_urls": [
        "https://support.claude.com/en/articles/8114513-business-associate-agreements-baa-for-commercial-customers"
      ],
      "last_verified": "2026-10-28",
      "notes": "As of Sept. 28, 2025, Anthropic trains on consumer conversations by default unless the user opts out — this reversed Anthropic's earlier no-training-by-default posture. Re-verify this periodically; it is a policy area that has already changed once."
    },
    {
      "id": "anthropic-claudeai-pro---max",
      "vendor": "Anthropic",
      "product": "Claude.ai",
      "tier": "Pro / Max",
      "tier_category": "Consumer Paid",
      "category": "General-purpose chatbot",
      "trains_on_input_by_default": true,
      "training_opt_out_available": true,
      "baa_available": false,
      "baa_notes": "Not covered — consumer plans are explicitly excluded from Anthropic's BAA program.",
      "dpa_available": false,
      "data_retention_default": "5-year retention if training is not opted out; 30 days if opted out.",
      "confidence": "verified",
      "source_urls": [
        "https://support.claude.com/en/articles/8114513-business-associate-agreements-baa-for-commercial-customers"
      ],
      "last_verified": "2026-10-28",
      "notes": "Same training/BAA posture as Free."
    },
    {
      "id": "anthropic-claude-team",
      "vendor": "Anthropic",
      "product": "Claude",
      "tier": "Team",
      "tier_category": "Business/Team",
      "category": "General-purpose chatbot",
      "trains_on_input_by_default": false,
      "training_opt_out_available": "n/a",
      "baa_available": false,
      "baa_notes": "Anthropic's own BAA article does not list Team plans as BAA-eligible.",
      "dpa_available": true,
      "data_retention_default": "Not used for training by default on commercial plans.",
      "confidence": "verified",
      "source_urls": [
        "https://support.claude.com/en/articles/8114513-business-associate-agreements-baa-for-commercial-customers"
      ],
      "last_verified": "2026-10-28",
      "notes": "A step up from consumer tiers (no training by default, DPA available) but not BAA-eligible — do not use for PHI."
    },
    {
      "id": "anthropic-claude-enterprise",
      "vendor": "Anthropic",
      "product": "Claude",
      "tier": "Enterprise",
      "tier_category": "Enterprise",
      "category": "General-purpose chatbot",
      "trains_on_input_by_default": false,
      "training_opt_out_available": "n/a",
      "baa_available": "conditional",
      "baa_notes": "BAA available, but only after the account's Primary Owner explicitly activates HIPAA compliance and signs the BAA under Data & Privacy settings — not covered by default on a standard Enterprise plan.",
      "dpa_available": true,
      "data_retention_default": "30-day retention requirement applies to \"Covered Models\" under the BAA once activated.",
      "confidence": "verified",
      "source_urls": [
        "https://support.claude.com/en/articles/8114513-business-associate-agreements-baa-for-commercial-customers"
      ],
      "last_verified": "2026-10-28",
      "notes": "Confirm the specific client's Enterprise account has actually activated HIPAA compliance — the plan tier alone does not guarantee BAA coverage."
    },
    {
      "id": "anthropic-api-platform-commercial-api",
      "vendor": "Anthropic",
      "product": "API Platform",
      "tier": "Commercial API",
      "tier_category": "API/Developer",
      "category": "LLM API",
      "trains_on_input_by_default": false,